{
  "schema": "fidryn.source-manifest/v0.1",
  "snapshot": "2026-08-23-ca-family-1610-1617",
  "jurisdiction": "California",
  "artifacts": [
    {
      "path": "ca-family-1610-1617.txt",
      "digest": "fixture",
      "kind": "statute",
      "effective": "2026-08-23"
    },
    {
      "path": "ava-noah-prenup.txt",
      "digest": "fixture",
      "kind": "private_instrument",
      "effective": "2026-08-23"
    }
  ]
}
