{
  "schema": "fidryn.source-manifest/v0.1",
  "snapshot": "2026-09-17-fcra-dispute",
  "jurisdiction": "UnitedStates.Federal",
  "artifacts": [
    {
      "path": "15usc-1681i.txt",
      "digest": "fixture",
      "kind": "statute",
      "effective": "2026-09-17",
      "weight": "binding"
    }
  ]
}
