{
  "schema": "fidryn.source-manifest/v0.1",
  "snapshot": "2026-09-17-ca-lab-201-203",
  "jurisdiction": "California",
  "artifacts": [
    {
      "path": "ca-lab-201-203.txt",
      "digest": "fixture",
      "kind": "statute",
      "effective": "2026-09-17",
      "weight": "binding"
    }
  ]
}
