{
  "schema": "fidryn.source-manifest/v0.1",
  "snapshot": "2026-09-17-dmca-512",
  "jurisdiction": "UnitedStates.Federal",
  "artifacts": [
    {
      "path": "17usc-512.txt",
      "digest": "fixture",
      "kind": "statute",
      "effective": "2026-09-17",
      "weight": "binding"
    }
  ]
}
