{
  "schema": "fidryn.source-manifest/v0.1",
  "snapshot": "2026-09-17-usc-title-catalog",
  "jurisdiction": "UnitedStates.Federal",
  "artifacts": [
    {
      "path": "olrc-about.txt",
      "digest": "fixture",
      "kind": "statute",
      "effective": "2026-09-17",
      "weight": "explanatory"
    }
  ]
}
