{
  "schema": "fidryn.source-manifest/v0.1",
  "snapshot": "2026-09-17-17cfr-230-501",
  "jurisdiction": "UnitedStates.Federal",
  "artifacts": [
    {
      "path": "17cfr-230-501.txt",
      "digest": "fixture",
      "kind": "regulation",
      "effective": "2026-09-17",
      "weight": "binding"
    }
  ]
}
